{
  "$schema": "./docs/schemas/brand.schema.json",
  "productName": "Murge",
  "shortName": "Murge",
  "description": "A desktop network client powered by mihomo.",
  "appId": "io.murge.desktop",
  "executableName": "murge",
  "protocolScheme": "murge",
  "defaultProfileName": "Murge Default",
  "companyName": "Murge Contributors",
  "repositoryUrl": "https://github.com/RoaycL/Murge",
  "supportUrl": "https://github.com/RoaycL/Murge/issues",
  "copyright": "Copyright © 2026 Murge Contributors",
  "legacyProductNames": ["Murge"],
  "legacyAppDataNamespaces": [],
  "updatePublicKey": "dW50cnVzdGVkIGNvbW1lbnQ6IG1pbmlzaWduIHB1YmxpYyBrZXk6IEIxM0MxOEYyN0U1QUREMUEKUldRYTNWcCs4aGc4c1VvUmNaR2VUSlNjUU9CNWdFVk9uTTlTVXk5a2ZjMjdRQm5VNVVLYVJ1aVMK"
}
